score,comments,created_utc,content,cleaned_content
5,6,1728653629.0,"Overstock.com (BYON) - DD - Bath Towels Are Back In Stock \*\*ATTENTION MODS AND HONOURABLE REPORT POLICE OF NEW: This DD and the company it covers is in no way related to the bankrupt legacy towel stock (RIP bagholders). This company was [Overstock.com](http://Overstock.com) and has rebranded itself. Bath towels are back, and they're better than ever before.

Alright, listen up, you’re only going to hear this once, and you’re only going to hear it from me, as no one else seems to be paying attention. I’ve been watching this company for YEARS waiting for the perfect moment to get in, and that moment is right now. Actually, it was last week on the day the last vestiges of peace Jared Kushner bestowed upon the Middle East finally evaporated. While simultaneously, the dock workers decided they were going to try to strongarm JPow into spinning up his money printer exclusively for their use --to fund their righteous battle against our future robot overlords. That day the stock hit a low of $8.91. The bottom is in.

About the Company:

[Overstock.com](http://Overstock.com) has been around a very long time, since 1999, but basically all you need to know about that is that they started out doing the thing their name suggests. Then they switched it up and started selling a more standard lineup of home goods. Their name just didn't reflect what they did anymore.

In 2023, the former crowd favorite’s bath towel retailer went tits up, and the CEO of Overstock at the time saw a golden opportunity. They snapped up the IP of ye old towel stock, along with the name, customer data, etc.. They rebranded the company to Beyond Inc., switched their website UI’s color scheme from red to blue, and slapped the old towel company’s name on it. (From here on I’ll refer to the forbidden name as triple-B, or 3B for short.)

But somehow it wasn't an instant success... Overstock's original customers were left out in the cold, and the returning bath towel customers didn't like their product lineup. Things kept on declining.

Enter Marcus Lemonis:



https://preview.redd.it/yi3ayo0yw4ud1.png?width=508&format=png&auto=webp&s=6a79453f4375c3d023bbe6b615fea95091281919

He currently serves as the chairman and CEO of Camping World, a multi-billion dollar giant. He’s an activist investor specializing in turning around struggling businesses, and was key in building Camping World into what it is today. In Late 2023 he purchased a stake in Beyond and joined the board. He laid out plans to turn the business around, bring back [Overstock.com](http://Overstock.com), and promised results by the end of 2024. Well...things took longer than expected, including the relaunch of the [Overstock.com](http://Overstock.com) website.

So this is what happened:

  


https://preview.redd.it/k29wwhq1x4ud1.png?width=1407&format=png&auto=webp&s=c6f07b394c5fae9a6100f0485d99947b5ca5fa0f

Now the stock is in the gutter, but the vision Lemonis has for the company is finally starting to come together.

If you only care about earnings reports and staring at charts you might look at those and say to me:

“Mr. Jimbles, you’re *highly* regarded. The revenue, EPS, and every other metric is worse YoY. The stock has been red every month for the past 6. This stock is going back to all-time lows, and likely, to zero.”

And to which I will respond:

“Why yes, thank you. I am highly regarded. You have an incredible talent for numbers and analysis. Slap an F rating on the stock, and go apply for a job at Motley Fool. They’d love to have you. You’ll fit right in there.”

But this what has happened very recently:

* In July 2024 the [Overstock.com](http://Overstock.com) website relaunched to exist alongside the new 3B website, specializing again in liquidating surplus inventory. 
* The Zulily IP, customer data, etc. was purchased in March of this year. If you haven’t heard of Zulily, they were another successful online retailer that went under after suffering from poor management, losing focus, and poor customer service, but the website had a cult following for its unique and exclusive selection of fashion goods.
* Beyond Inc. hired some of Zulily’s former team, and are bringing back your mom’s favorite fashion brands. They just soft-launched the new website a few weeks ago, but haven’t made any official announcement yet. [Zulily.com](http://zulily.com)
* Three new strategic partnerships have been teased that will restore a physical retail presence to the 3B brand. Now you might be thinking to yourself that this is a bad move, but having a physical store makes a lot of sense for home goods. Last I checked, you can’t download a credenza, and some people like to make sure the drapes match the carpet in person. One of these partnerships will deal with the Overstock arm of the business and will give them access to increased inventory and infrastructure to move what they already have.
* They just announced a new global licensing program to expand business internationally.
* They sold off their company HQ offices for $55m. Their balance sheet is good. Almost zero debt and plenty of cash for their upcoming moves.

But that isn’t it by a long-shot. Lemonis has a vision for the Beyond umbrella to expand and include a whole slew of home related products and services including mortgages, home insurance, HELOCs, consumer credit cards, etc.. They plan to leverage the customer data gained from the retail businesses to onboard their existing customers for these other products in a frictionless, low cost way.

And even though this pivot is finally taking shape now, none of it has been priced in. It may have been last fall based solely on hype when Lemonis joined the board, when the stock hit almost $40, but it definitely isn’t as of right now. Lucky me.

Maybe some other charts and light TA will convince you though.



https://preview.redd.it/e14afd63x4ud1.png?width=1440&format=png&auto=webp&s=2a10afa53ba0956584ce72106fd4fae5a8fdb9b3

What we have right here is RSI divergence on the weekly chart. The stock price is marching down, making lower lows, while RSI is trending up, making higher lows. Titillating, I know.

You like Bollinger Bands??? Well here you go:

  


https://preview.redd.it/rrf6twx4x4ud1.png?width=1440&format=png&auto=webp&s=3919615e3efb1dfb2c607e2ceda81efa27f7b49c

On the daily, it’s consolidated, and the bands are tight enough to turn your wife’s boyfriend into a two pump chump. You can see it bounced hard off the bottom band in the past few days.

Look at what happened last Friday when the dock workers settled for an insulting 62% raise and a guarantee that efficiency would not get in the way of union boss salaries:

  


https://preview.redd.it/4kzlw1r5x4ud1.png?width=1445&format=png&auto=webp&s=14f6bbd1ebff4210af79e2eef6995167c886a1f5

So what makes me sooooo smart and special? Nothing. I just happen to be in the right place at the right time. Like I said, I’ve been watching this stock/company for years as a matter of personal interest. This is the inflection point. No one cares about this stock and most people still think the 3B brand no longer exists at all. Analysts are asleep at the wheel, relying on ChatGPT to do their work for them, and GPT doesn’t know how to spoof an email and listen to a webcast yet.

Here’s the webcast featuring Lemonis that took place on Sept. 10:

[https://investors.beyond.com/news-events/events-and-presentations/events/event-details/2024/Piper-Sandler-Growth-Frontiers-Conference/default.aspx](https://investors.beyond.com/news-events/events-and-presentations/events/event-details/2024/Piper-Sandler-Growth-Frontiers-Conference/default.aspx) 

Listen to it…or don’t. I don’t care. Lemonis goes into much more detail about the upcoming partnerships that will be announced at the investor conference happening on the day of earnings, as well as his vision for the company going forward. And he explains it all much better than some random regard on reddit ever could. He also takes ownership for the past mistakes that got us to where we are now.

If you still aren’t convinced, cool. Go buy calls into NVIDIA earnings and enjoy crying in your wife’s boyfriend’s arms for a few days just like last time. Or buy the top on that incredible space stock after it’s up 20x in less than 6 months, get rug-pulled with a $400m share offering, and get rekt by the news drought. Or go do what Nana would want --buying deep ITMs in her meme stock... at least *she* might be proud of you.

So what do I expect with the BYON stock?

Short/medium term: Up.  
Long term: Really up.

It looks good long term as everything spins up and the company transitions over the course of the next year. I don’t think analysts have accounted for the $177m run rate the newly relaunched Overstock website has hit since it went live at the beginning of Q3, or the fact that Zulily has been online for weeks already. Earnings will likely hit or exceed expectations, and even if it doesn’t, the partnerships being unveiled at the investor meeting and forward guidance will be impressive. There will likely be a runup even before earnings. When this stock moves, it MOVES.

Here are my current positions as of writing this, but I'm not done buying yet...not even close. A YOLO update will follow after I've finished.

Positions:

https://preview.redd.it/ikdcrnv7x4ud1.png?width=1097&format=png&auto=webp&s=cc49f739ee9e7bf277bac88bd08ed12d3e52abcb

Shotgun approach. Who knows when this thing will make its biggest moves.

The random smattering of strikes may make you think I'm even more regarded than before, but liquidity is extremely thin and there were hot deals on different strikes at different times.

\*\*Tips if you feel this is a play you want to make and realize that if you just buy shares you're throwing your future gains in the trash:

Liquidity on most option strikes/expiries is THIN, especially on the OTMs. Wait. wait. *wait.* You're thinking you'll just avoid all this by buying ITM/NTM? On a stock this undervalued?? Go back to where you belong. You know...that special sub where their best and only advice is DCA'ing into SPY.

I recommend doing limits or 1 lot market orders b/c you might even get a few better fills that way. If you do big market orders you’re gonna get cucked on the way in and on the way out… if you make it that far. If you don’t know what the word slippage means...good luck. \*\*Hint\*\* It doesn't have anything to do with what happens to your wife while watching you unbutton her boyfriend's sport-coat.

See y'all in a bit.

-Jimbles

\*\*Disclaimer: All information contained in this post is factually correct to the best of my knowledge. However, I provide no guarantees, and will not be held liable for any errors that may be contained within. Check the facts and do your own research. None of this content is financial advice.","overstockcom byon  dd  bath towels are back in stock attention mods and honourable report police of new this dd and the company it covers is in no way related to the bankrupt legacy towel stock rip bagholders this company was overstockcom and has rebranded itself bath towels are back and theyre better than ever before

alright listen up youre only going to hear this once and youre only going to hear it from me as no one else seems to be paying attention ive been watching this company for years waiting for the perfect moment to get in and that moment is right now actually it was last week on the day the last vestiges of peace jared kushner bestowed upon the middle east finally evaporated while simultaneously the dock workers decided they were going to try to strongarm jpow into spinning up his money printer exclusively for their use to fund their righteous battle against our future robot overlords that day the stock hit a low of  the bottom is in

about the company

overstockcom has been around a very long time since  but basically all you need to know about that is that they started out doing the thing their name suggests then they switched it up and started selling a more standard lineup of home goods their name just didnt reflect what they did anymore

in  the former crowd favorites bath towel retailer went tits up and the ceo of overstock at the time saw a golden opportunity they snapped up the ip of ye old towel stock along with the name customer data etc they rebranded the company to beyond inc switched their website uis color scheme from red to blue and slapped the old towel companys name on it from here on ill refer to the forbidden name as tripleb or b for short

but somehow it wasnt an instant success overstocks original customers were left out in the cold and the returning bath towel customers didnt like their product lineup things kept on declining

enter marcus lemonis





he currently serves as the chairman and ceo of camping world a multibillion dollar giant hes an activist investor specializing in turning around struggling businesses and was key in building camping world into what it is today in late  he purchased a stake in beyond and joined the board he laid out plans to turn the business around bring back overstockcom and promised results by the end of  wellthings took longer than expected including the relaunch of the overstockcom website

so this is what happened

  




now the stock is in the gutter but the vision lemonis has for the company is finally starting to come together

if you only care about earnings reports and staring at charts you might look at those and say to me

mr jimbles youre highly regarded the revenue eps and every other metric is worse yoy the stock has been red every month for the past  this stock is going back to alltime lows and likely to zero

and to which i will respond

why yes thank you i am highly regarded you have an incredible talent for numbers and analysis slap an f rating on the stock and go apply for a job at motley fool theyd love to have you youll fit right in there

but this what has happened very recently

 in july  the overstockcom website relaunched to exist alongside the new b website specializing again in liquidating surplus inventory 
 the zulily ip customer data etc was purchased in march of this year if you havent heard of zulily they were another successful online retailer that went under after suffering from poor management losing focus and poor customer service but the website had a cult following for its unique and exclusive selection of fashion goods
 beyond inc hired some of zulilys former team and are bringing back your moms favorite fashion brands they just softlaunched the new website a few weeks ago but havent made any official announcement yet zulilycom
 three new strategic partnerships have been teased that will restore a physical retail presence to the b brand now you might be thinking to yourself that this is a bad move but having a physical store makes a lot of sense for home goods last i checked you cant download a credenza and some people like to make sure the drapes match the carpet in person one of these partnerships will deal with the overstock arm of the business and will give them access to increased inventory and infrastructure to move what they already have
 they just announced a new global licensing program to expand business internationally
 they sold off their company hq offices for m their balance sheet is good almost zero debt and plenty of cash for their upcoming moves

but that isnt it by a longshot lemonis has a vision for the beyond umbrella to expand and include a whole slew of home related products and services including mortgages home insurance helocs consumer credit cards etc they plan to leverage the customer data gained from the retail businesses to onboard their existing customers for these other products in a frictionless low cost way

and even though this pivot is finally taking shape now none of it has been priced in it may have been last fall based solely on hype when lemonis joined the board when the stock hit almost  but it definitely isnt as of right now lucky me

maybe some other charts and light ta will convince you though





what we have right here is rsi divergence on the weekly chart the stock price is marching down making lower lows while rsi is trending up making higher lows titillating i know

you like bollinger bands well here you go

  




on the daily its consolidated and the bands are tight enough to turn your wifes boyfriend into a two pump chump you can see it bounced hard off the bottom band in the past few days

look at what happened last friday when the dock workers settled for an insulting  raise and a guarantee that efficiency would not get in the way of union boss salaries

  




so what makes me sooooo smart and special nothing i just happen to be in the right place at the right time like i said ive been watching this stockcompany for years as a matter of personal interest this is the inflection point no one cares about this stock and most people still think the b brand no longer exists at all analysts are asleep at the wheel relying on chatgpt to do their work for them and gpt doesnt know how to spoof an email and listen to a webcast yet

heres the webcast featuring lemonis that took place on sept 

 

listen to itor dont i dont care lemonis goes into much more detail about the upcoming partnerships that will be announced at the investor conference happening on the day of earnings as well as his vision for the company going forward and he explains it all much better than some random regard on reddit ever could he also takes ownership for the past mistakes that got us to where we are now

if you still arent convinced cool go buy calls into nvidia earnings and enjoy crying in your wifes boyfriends arms for a few days just like last time or buy the top on that incredible space stock after its up x in less than  months get rugpulled with a m share offering and get rekt by the news drought or go do what nana would want buying deep itms in her meme stock at least she might be proud of you

so what do i expect with the byon stock

shortmedium term up  
long term really up

it looks good long term as everything spins up and the company transitions over the course of the next year i dont think analysts have accounted for the m run rate the newly relaunched overstock website has hit since it went live at the beginning of q or the fact that zulily has been online for weeks already earnings will likely hit or exceed expectations and even if it doesnt the partnerships being unveiled at the investor meeting and forward guidance will be impressive there will likely be a runup even before earnings when this stock moves it moves

here are my current positions as of writing this but im not done buying yetnot even close a yolo update will follow after ive finished

positions



shotgun approach who knows when this thing will make its biggest moves

the random smattering of strikes may make you think im even more regarded than before but liquidity is extremely thin and there were hot deals on different strikes at different times

tips if you feel this is a play you want to make and realize that if you just buy shares youre throwing your future gains in the trash

liquidity on most option strikesexpiries is thin especially on the otms wait wait wait youre thinking youll just avoid all this by buying itmntm on a stock this undervalued go back to where you belong you knowthat special sub where their best and only advice is dcaing into spy

i recommend doing limits or  lot market orders bc you might even get a few better fills that way if you do big market orders youre gonna get cucked on the way in and on the way out if you make it that far if you dont know what the word slippage meansgood luck hint it doesnt have anything to do with what happens to your wife while watching you unbutton her boyfriends sportcoat

see yall in a bit

jimbles

disclaimer all information contained in this post is factually correct to the best of my knowledge however i provide no guarantees and will not be held liable for any errors that may be contained within check the facts and do your own research none of this content is financial advice"
307,60,1728571564.0,"Discovered options about 3 months ago How am I doing? 
","discovered options about  months ago how am i doing 
"
4,2,1728655194.0,Ketamine gains ,ketamine gains 
54,9,1728602234.0,"$SQ $22,000 Gain! ",sq  gain 
41,38,1728598994.0,In only five months. It was fun while it lasted ,in only five months it was fun while it lasted 
24,9,1728608453.0,"Netflix gains almost 100% All in ROTH IRA
 

Total contribution since 2019 : $37,500","netflix gains almost  all in roth ira
 

total contribution since   "
14,13,1728620598.0,"Spirit Airlines - A look into the future  As many of you all know by now, Spirit Airlines has had a rough couple of years. They have not been profitable since before COVID and their failed merger with JetBlue has caused their stock to plummet by 95% in the past years. Recently, the WSJ has reported that Spirit Airlines has filed for Chapter 11 bankruptcy which should not be confused for a Chapter 7 bankruptcy. A Chapter 7 bankruptcy involves the immediate selling of assets to pay back creditors while Chapter 11 is less severe and involves a reorganizational plan to pay back their debt. This distinction is very important because it does not mean that Spirit Airlines is for sure a dead company....yet?...maybe?

Creditors

* Spirit Airlines faces a deadline from its creditors to refinance or extend those notes by 10/21
   * If Spirit is able to refinance their debt, I would safely say that their stock price would increase
   * In addition, if Spirit was able to refinance their debt, this could allow Spirit to tap into the capital market and help them raise more money for a potential turnaround in the future
* Creditors may be inclined to extend their notes because they also have a lot to loose and the Justice Department claiming that Spirit is essential for travelers could build more confidence in the company

Earnings

* Earnings are expected to drop on 10/24 and the estimate is -$2.32...
   * This honestly is not surprising and I can see it going even lower then estimated but I also think it will not affect the price of the stock much
* If Spirit was to beat earnings, it could possibly prove that this company is still alive and has a potential for a turnaround

I felt like updating you guys about Spirit and their potential for a come back but who knows, I am just a Wendy's employee 

Positions: 9 $10 6/20/25 C ( Not too much as this is still a very risky play but stranger things have happened)

 ","spirit airlines  a look into the future  as many of you all know by now spirit airlines has had a rough couple of years they have not been profitable since before covid and their failed merger with jetblue has caused their stock to plummet by  in the past years recently the wsj has reported that spirit airlines has filed for chapter  bankruptcy which should not be confused for a chapter  bankruptcy a chapter  bankruptcy involves the immediate selling of assets to pay back creditors while chapter  is less severe and involves a reorganizational plan to pay back their debt this distinction is very important because it does not mean that spirit airlines is for sure a dead companyyetmaybe

creditors

 spirit airlines faces a deadline from its creditors to refinance or extend those notes by 
    if spirit is able to refinance their debt i would safely say that their stock price would increase
    in addition if spirit was able to refinance their debt this could allow spirit to tap into the capital market and help them raise more money for a potential turnaround in the future
 creditors may be inclined to extend their notes because they also have a lot to loose and the justice department claiming that spirit is essential for travelers could build more confidence in the company

earnings

 earnings are expected to drop on  and the estimate is 
    this honestly is not surprising and i can see it going even lower then estimated but i also think it will not affect the price of the stock much
 if spirit was to beat earnings it could possibly prove that this company is still alive and has a potential for a turnaround

i felt like updating you guys about spirit and their potential for a come back but who knows i am just a wendys employee 

positions    c  not too much as this is still a very risky play but stranger things have happened

 "
5365,593,1728503087.0,Hurricane Milton could cost Disney World $200 million ,hurricane milton could cost disney world  million 
259,35,1728559753.0,"I ain’t hear no bell  Options ruined some cash positions…resolved to make it back, otherwise I’ll be applying to Wendy’s. Heard their krabby patty sucked so we’ll see tho. ",i aint hear no bell  options ruined some cash positionsresolved to make it back otherwise ill be applying to wendys heard their krabby patty sucked so well see tho 
