score,comments,created_utc,content,cleaned_content
80,2905,1728640632.0,"Daily Discussion Thread for October 11, 2024 [View Post](https://sh.reddit.com/r/wallstreetbets/comments/1g166ia)",daily discussion thread for october   view post
3,0,1728656177.0,Weekly Earnings Thread 10/14 - 10/18 ,weekly earnings thread    
9468,3433,1728621111.0,Tesla Robovan  ,tesla robovan  
4616,1298,1728620714.0,Cybercab demo  ,cybercab demo  
5250,248,1728611955.0,Insurance companies in FL right now ,insurance companies in fl right now 
1563,582,1728623021.0,Cybercab first ride ,cybercab first ride 
857,300,1728621917.0,Optimus can talk ,optimus can talk 
964,916,1728615953.0,Musk - Robotaxi to be $30k and confirmed to be available in 2026 Extrmeely bullishh,musk  robotaxi to be k and confirmed to be available in  extrmeely bullishh
426,105,1728624415.0,I’ll never touch options again  Roast me. Discovered options in March 24. Quick spike up and made about 10k.. all downhill from then. Lost 20k since the end of august mostly on NVDA earnings and IV crush got me. ,ill never touch options again  roast me discovered options in march  quick spike up and made about k all downhill from then lost k since the end of august mostly on nvda earnings and iv crush got me 
235,245,1728631133.0,All in Tesla? ,all in tesla 
349,26,1728617390.0,I have seen that jacket before… ,i have seen that jacket before 
698,120,1728588546.0,"Big come back Had a big come back, I was down approximately 45k at one point. Loss after loss after loss.

Shifted my strategy to options that are “safer,” also I stopped attempting to earn large returns, I sold after 10% returns on average.

My main strategy was SPY calls, I would wait for a quick sell off, and buy in. If it went against me, I would buy more. Cut loses at 25%.

I would buy calls depending on how i perceived sentiment. I strongly believe what makes a trader successful, is if he or she can effectively gauge sentiment. Not lines on a chart and dumb shit like “bollinger bands.”

I do not consider myself a successful trading overall, but I can say that sentiment is everything.

My strategy will work until it doesn’t.","big come back had a big come back i was down approximately k at one point loss after loss after loss

shifted my strategy to options that are safer also i stopped attempting to earn large returns i sold after  returns on average

my main strategy was spy calls i would wait for a quick sell off and buy in if it went against me i would buy more cut loses at 

i would buy calls depending on how i perceived sentiment i strongly believe what makes a trader successful is if he or she can effectively gauge sentiment not lines on a chart and dumb shit like bollinger bands

i do not consider myself a successful trading overall but i can say that sentiment is everything

my strategy will work until it doesnt"
26,44,1728648554.0,"TESLA CYBERCAB VS WAYMO : AN ANALYSIS  For all the regards who don't know, Waymo is the market leader in true autonomous vehicles right now. They have been operating a fleet of robo taxis (fully autonomous cars) in multiple cities for a while now. 

So I did a short comparison and analysis. 



KEY POINTS FROM ""WE, ROBOT"" EVENT:



1. The robotaxi is a purpose-built autonomous vehicle, lacking a steering wheel or pedals, meaning it will need approval from regulators before going into production.

.
.

2. Tesla plans to launch fully autonomous driving in Texas and California next year, with the Cybercab production by 2026 — although he said it could be as late as 2027. 

.
.

3. Tesla is developing the Optimus robot, which could be available for $20,000-$30,000, and is capable of performing various tasks.


.
.

4. Cybercab was revealed the prototype robotaxi at Tesla's ""We, Robot” event held at the Warner Bros. film lot in Burbank, California, with a lot of non-public roads for the demonstration. 


.
.

5. Tesla has reportedly been mapping the area in advance of the demonstration, even though the company says it doesn't rely on high-definition maps to power its Full Self-Driving (FSD) driver-assist feature


.
.
.


TESLA VS WAYMO : KEY DIFFERENCES IN TECHNOLOGY AND APPROACH 



.
.

1. Sensing the World:

 -  - Waymo's Multi-Sensor Fusion:  Waymo uses a suite of sensors that work together. This is like having multiple senses.


I. Lidar:  Acts like super-precise radar, creating a 3D ""point cloud"" of the surroundings. This excels in low-light and complex environments.

II. Radar: Detects objects and their speed, even in rain or fog.
   

III. Cameras: Provide visual information for recognizing objects like traffic lights and pedestrians.




- - Tesla's Vision-Only System: Tesla relies heavily on cameras, believing that they can provide enough data for AI to understand the world like humans do.


I. Neural Networks:  Tesla uses powerful AI to process the visual data from cameras.


II. No Lidar:  Tesla famously excludes lidar, arguing it's expensive and unnecessary.


- Why this matters:  Lidar provides highly accurate depth and distance data, which is crucial for navigating complex situations. Tesla's vision-only approach is more ambitious but may struggle in conditions where cameras are less effective (e.g., heavy rain, fog).



.
.


2. Understanding the Environment:

I. Waymo's HD Maps: Waymo creates incredibly detailed 3D maps of the areas where its vehicles operate. These maps include road geometry, lane markings, traffic signs, and even the positions of trees and buildings.


II.  Localization: This allows Waymo's cars to precisely locate themselves within the map, even in challenging conditions.


III. Predictability:  Maps help anticipate what's coming and plan routes accordingly.


IV.  Tesla's Real-Time Learning: Tesla relies less on pre-mapped environments. Its AI learns to interpret the world in real-time, based on the data it gathers from its cameras.


V. Generalization: The goal is to create a system that can drive anywhere, not just in pre-mapped areas.


VI. Adaptability: Tesla's system can potentially adapt to new environments and situations more quickly.



- - Why this matters: Waymo's HD maps provide a high level of certainty in known areas, but mapping is expensive and time-consuming. Tesla's approach is more scalable but relies heavily on the AI's ability to correctly interpret complex scenes.



.
.
.

3. Deployment Strategies:

I. Waymo's Gradual Rollout: Waymo has focused on deploying its robotaxi service in specific cities, starting with Phoenix. This allows for careful testing and refinement in controlled environments.


II.  Safety First:  Waymo prioritizes safety and has a strong track record.

III.  Controlled Expansion:  They expand their service area gradually as they gain confidence in their technology.



 IV.  Tesla's Beta Testing: Tesla has released its Full Self-Driving (FSD) beta software to a wider group of drivers. This allows them to gather vast amounts of real-world driving data.


V.  Rapid Iteration:  Tesla can quickly improve its system through frequent software updates.


 VI. Driver Responsibility:  FSD is still a driver-assist system, and drivers are expected to remain vigilant and take over when necessary.


- -  Why this matters: Waymo's approach is more cautious, prioritizing safety and controlled testing. Tesla's approach is faster and more agile, but it also carries more risk, as evidenced by accidents involving FSD.



These are some of the core differences between Waymo and Tesla's approach to self-driving. Both companies are pushing the boundaries of technology, but their philosophies and strategies are quite distinct. It will be fascinating to see how these approaches evolve in the years to come.




. . . . .


. . . . .

TLDR;


for me personally, the event was disappointing. Elon announced (NOT ACTUALLY LAUNCHED) basically what he has been promising for years (TRUE AUTONOMY AKA FSD).

It was no different than the previous announcements of FSD and Cybertruk.

I expect delays (regulatory approvals and the actual tech being ready)


. . . . .



. . . . . 


UPDATE :

. . . . . 

For all the regards who don't understand what WAYMO actually is, I just did another post analyzing Google (the owner of Waymo) and why they're the number 1 player in AI. 

https://www.reddit.com/r/wallstreetbets/s/LirixJK6s6","tesla cybercab vs waymo  an analysis  for all the regards who dont know waymo is the market leader in true autonomous vehicles right now they have been operating a fleet of robo taxis fully autonomous cars in multiple cities for a while now 

so i did a short comparison and analysis 



key points from we robot event



 the robotaxi is a purposebuilt autonomous vehicle lacking a steering wheel or pedals meaning it will need approval from regulators before going into production




 tesla plans to launch fully autonomous driving in texas and california next year with the cybercab production by   although he said it could be as late as  




 tesla is developing the optimus robot which could be available for  and is capable of performing various tasks





 cybercab was revealed the prototype robotaxi at teslas we robot event held at the warner bros film lot in burbank california with a lot of nonpublic roads for the demonstration 





 tesla has reportedly been mapping the area in advance of the demonstration even though the company says it doesnt rely on highdefinition maps to power its full selfdriving fsd driverassist feature







tesla vs waymo  key differences in technology and approach 






 sensing the world

    waymos multisensor fusion  waymo uses a suite of sensors that work together this is like having multiple senses


i lidar  acts like superprecise radar creating a d point cloud of the surroundings this excels in lowlight and complex environments

ii radar detects objects and their speed even in rain or fog
   

iii cameras provide visual information for recognizing objects like traffic lights and pedestrians




  teslas visiononly system tesla relies heavily on cameras believing that they can provide enough data for ai to understand the world like humans do


i neural networks  tesla uses powerful ai to process the visual data from cameras


ii no lidar  tesla famously excludes lidar arguing its expensive and unnecessary


 why this matters  lidar provides highly accurate depth and distance data which is crucial for navigating complex situations teslas visiononly approach is more ambitious but may struggle in conditions where cameras are less effective eg heavy rain fog







 understanding the environment

i waymos hd maps waymo creates incredibly detailed d maps of the areas where its vehicles operate these maps include road geometry lane markings traffic signs and even the positions of trees and buildings


ii  localization this allows waymos cars to precisely locate themselves within the map even in challenging conditions


iii predictability  maps help anticipate whats coming and plan routes accordingly


iv  teslas realtime learning tesla relies less on premapped environments its ai learns to interpret the world in realtime based on the data it gathers from its cameras


v generalization the goal is to create a system that can drive anywhere not just in premapped areas


vi adaptability teslas system can potentially adapt to new environments and situations more quickly



  why this matters waymos hd maps provide a high level of certainty in known areas but mapping is expensive and timeconsuming teslas approach is more scalable but relies heavily on the ais ability to correctly interpret complex scenes







 deployment strategies

i waymos gradual rollout waymo has focused on deploying its robotaxi service in specific cities starting with phoenix this allows for careful testing and refinement in controlled environments


ii  safety first  waymo prioritizes safety and has a strong track record

iii  controlled expansion  they expand their service area gradually as they gain confidence in their technology



 iv  teslas beta testing tesla has released its full selfdriving fsd beta software to a wider group of drivers this allows them to gather vast amounts of realworld driving data


v  rapid iteration  tesla can quickly improve its system through frequent software updates


 vi driver responsibility  fsd is still a driverassist system and drivers are expected to remain vigilant and take over when necessary


   why this matters waymos approach is more cautious prioritizing safety and controlled testing teslas approach is faster and more agile but it also carries more risk as evidenced by accidents involving fsd



these are some of the core differences between waymo and teslas approach to selfdriving both companies are pushing the boundaries of technology but their philosophies and strategies are quite distinct it will be fascinating to see how these approaches evolve in the years to come




    


    

tldr


for me personally the event was disappointing elon announced not actually launched basically what he has been promising for years true autonomy aka fsd

it was no different than the previous announcements of fsd and cybertruk

i expect delays regulatory approvals and the actual tech being ready


    



     


update 

     

for all the regards who dont understand what waymo actually is i just did another post analyzing google the owner of waymo and why theyre the number  player in ai 

"
19,10,1728654174.0,Tesla Puts overnight ,tesla puts overnight 
15,6,1728655136.0,Tesla short results  The shit show paid out as expected ,tesla short results  the shit show paid out as expected 
39,20,1728635209.0,the first option trade continues to be a winner who ,the first option trade continues to be a winner who 
91,174,1728618846.0,"Tesla Cybercab: Below $30,000 Cost and 2026 Production ",tesla cybercab below  cost and  production 
793,401,1728572350.0,"Musk to unveil Robotaxi tonight Tesla’s first product event since the unveiling of the Cybertruck in 2019.

Time for massive puts?


https://www.theverge.com/2024/10/9/24265781/tesla-robotaxi-elon-musk-claims-safety-driverless-level-5","musk to unveil robotaxi tonight teslas first product event since the unveiling of the cybertruck in 

time for massive puts


"
841,105,1728569011.0,"‘We Underestimated’ Nvidia, Says $50 Billion Manager Impax ",we underestimated nvidia says  billion manager impax 
52,85,1728620292.0,Tesla Cybercab ,tesla cybercab 
10,8,1728650026.0,"US Producer Inflation To Slow Slightly Factory gate prices in the US are expected to have risen 0.1% mom in September slightly lower than the previous month's 0.2% uptick. On an annual basis, producer price inflation is anticipated to ease to 1.6%, a seven-month low. The core PPI is projected to rise 0.2% on the month, below 0.3% in August. However, the annual core rate is likely to accelerate to 2.7% from 2.4%.",us producer inflation to slow slightly factory gate prices in the us are expected to have risen  mom in september slightly lower than the previous months  uptick on an annual basis producer price inflation is anticipated to ease to  a sevenmonth low the core ppi is projected to rise  on the month below  in august however the annual core rate is likely to accelerate to  from 
44,20,1728624434.0,"THE PEAK SQUEAK: A little known, leading market indicator Let me preface this by saying I live in a HCOL area in a major city. These observations are indicative of what I believe to be generally high earners that live in a wealthy suburb with median home prices >$1MM

I was in the drive thru behind a 2024 Escalade and had to repeat my order 3 times because this motherfucker’s brakes were sending shockwaves all the way to the fryer. She couldn’t have been going more than 3 mph and the squeak emitting from her vehicle was severely disrupting my order.

Now this can only mean one thing:

Suburban mom’s are cucking themselves out of new brake pads because the damn grocery bill is too high. Thus, their husband won’t be able to afford their new boyfriend’s rent. This is a serious issue that could lead to the total collapse of the middle class in America.

I need you to observe how much squeak you hear on the roadways this weekend. I fear we’re reaching peak squeak. Brake pads are the perfect middle ground between disposable income and necessity purchases and when they go we know what’s next.

Fear the squeak. 25 SPY 570p 10/31","the peak squeak a little known leading market indicator let me preface this by saying i live in a hcol area in a major city these observations are indicative of what i believe to be generally high earners that live in a wealthy suburb with median home prices mm

i was in the drive thru behind a  escalade and had to repeat my order  times because this motherfuckers brakes were sending shockwaves all the way to the fryer she couldnt have been going more than  mph and the squeak emitting from her vehicle was severely disrupting my order

now this can only mean one thing

suburban moms are cucking themselves out of new brake pads because the damn grocery bill is too high thus their husband wont be able to afford their new boyfriends rent this is a serious issue that could lead to the total collapse of the middle class in america

i need you to observe how much squeak you hear on the roadways this weekend i fear were reaching peak squeak brake pads are the perfect middle ground between disposable income and necessity purchases and when they go we know whats next

fear the squeak  spy p "
517,384,1728572507.0,"If Google breaks up into multiple companies is that a good thing? The DOJ is seriously considering breaking up Google as a potential option.

If that happens, for existing shareholders, is that a good thing in the long run?

YouTube alone is a multibillion dollar company.","if google breaks up into multiple companies is that a good thing the doj is seriously considering breaking up google as a potential option

if that happens for existing shareholders is that a good thing in the long run

youtube alone is a multibillion dollar company"
58,29,1728613286.0,"Window closing for Pepsi to buy Celsius (CELH) Time is running out for Pepsi to buy Celsius (CELH) 

The bottom is in on Celsius.  The news has been positive and today’s move up broke a pretty long downward trend.  They are down 70% off their ATH.  Everyone also saw Pepsi’s recent earnings results which were not terrible but not great either.  

Pepsi owns Rockstar which tastes like carbonated piss with 8 drops of black licorice and 2 drops of patchouli essential oil.  Monster is owned by Coke and drank by hillbillies at monster truck rallies with un-neutered dogs.  Red Bull is for our exact opposites who work at Goldman Sachs until 1 in the morning everyday because Cramer says thats what they should be doing.

Celsius actually tastes delicious and doesn’t give you the shakes.  It is in every convenience store and grocery store, Walmart and Amazon, and the best store of all….Costco.  They are very popular with the younger generation which is what you want to build on.  Most importantly, they have a ton of international expansion still to do.  

Pepsi already owns 8.5% of Celsius.  It is unlikely it will ever be this cheap again.  It’s the Black Friday sale for Celsius….Hopefully Pepsi steps up to drink a six pack of Kiwi-Strawberry and make an offer they can’t refuse.

Positions:  3k shares and $35 C 10/11/24","window closing for pepsi to buy celsius celh time is running out for pepsi to buy celsius celh 

the bottom is in on celsius  the news has been positive and todays move up broke a pretty long downward trend  they are down  off their ath  everyone also saw pepsis recent earnings results which were not terrible but not great either  

pepsi owns rockstar which tastes like carbonated piss with  drops of black licorice and  drops of patchouli essential oil  monster is owned by coke and drank by hillbillies at monster truck rallies with unneutered dogs  red bull is for our exact opposites who work at goldman sachs until  in the morning everyday because cramer says thats what they should be doing

celsius actually tastes delicious and doesnt give you the shakes  it is in every convenience store and grocery store walmart and amazon and the best store of allcostco  they are very popular with the younger generation which is what you want to build on  most importantly they have a ton of international expansion still to do  

pepsi already owns  of celsius  it is unlikely it will ever be this cheap again  its the black friday sale for celsiushopefully pepsi steps up to drink a six pack of kiwistrawberry and make an offer they cant refuse

positions  k shares and  c "
110,9,1728601268.0,I’ll keep drinking Celsius…. forever ! Gains not as big as others on here…. But I’ll take it! I can finally afford some McDonald’s ,ill keep drinking celsius forever  gains not as big as others on here but ill take it i can finally afford some mcdonalds 
165,7296,1728590230.0,"What Are Your Moves Tomorrow, October 11, 2024 [View Post](https://sh.reddit.com/r/wallstreetbets/comments/1g0rmwo)",what are your moves tomorrow october   view post
574,437,1728563781.0,"US Core Inflation Unexpectedly Rises The annual core consumer price inflation rate in the United States, which excludes items such as food and energy, edged higher to 3.3% in September of 2024 from the three-year low of 3.2% recorded in the two previous months, and ahead of market expectations that it would stay at 3.2%.",us core inflation unexpectedly rises the annual core consumer price inflation rate in the united states which excludes items such as food and energy edged higher to  in september of  from the threeyear low of  recorded in the two previous months and ahead of market expectations that it would stay at 
17,23,1728630329.0,"$2 H100s: How the GPU Bubble Burst *Do we yet have an answer to [the $600bn question](https://www.latent.space/p/mar-jun-2024)? It is now consensus that the capex on foundation model training is the “[fastest depreciating asset in history](https://x.com/GavinSBaker/status/1720819375517716610)”, but the jury on GPU infra spend is still out and [the GPU Rich Wars are raging](https://www.latent.space/i/140396949/mixtral-sparks-a-gpuinference-race-to-the-bottom). Meanwhile, we know now that frontier labs are spending more on training+inference than they make in revenue, [raising $6.6b in the largest venture round of all time](https://www.bloomberg.com/news/articles/2024-10-02/openai-has-closed-new-funding-round-raising-over-6-5-billion) while also [projecting losses of $14b in 2026](https://www.theinformation.com/articles/openai-projections-imply-losses-tripling-to-14-billion-in-2026?rc=ytp67n). The financial logic requires AGI to parse.*

Last year, H100s were $8/hr if you could get them. Today, there's 7 different resale markets selling them under $2. What happened?


[full article here](https://www.latent.space/p/gpu-bubble)"," hs how the gpu bubble burst do we yet have an answer to the bn question it is now consensus that the capex on foundation model training is the fastest depreciating asset in history but the jury on gpu infra spend is still out and the gpu rich wars are raging meanwhile we know now that frontier labs are spending more on traininginference than they make in revenue raising b in the largest venture round of all time while also projecting losses of b in  the financial logic requires agi to parse

last year hs were hr if you could get them today theres  different resale markets selling them under  what happened


full article here"
