score,comments,created_utc,content,cleaned_content
17,5,1728611656.0,"Buffett Cuts Stake in BofA to below 10% https://finance.yahoo.com/news/buffetts-berkshire-cuts-stake-bofa-232457020.html

Warren Buffett’s Berkshire Hathaway has sold $10.5bn worth of Bank of America shares in a selling spree that began in July, as the sprawling industrial conglomerate dumps an investment that dates to the global financial crisis. 

The company disclosed on Thursday that it had sold a further 13.6mn shares this week worth $546mn, taking Berkshire’s stake in the bank below 10 per cent.

That threshold is critical and means Berkshire will no longer have to report its dispositions of Bank of America stock within days of the transactions. Berkshire’s remaining stake is worth roughly $31bn.
","buffett cuts stake in bofa to below  

warren buffetts berkshire hathaway has sold bn worth of bank of america shares in a selling spree that began in july as the sprawling industrial conglomerate dumps an investment that dates to the global financial crisis 

the company disclosed on thursday that it had sold a further mn shares this week worth mn taking berkshires stake in the bank below  per cent

that threshold is critical and means berkshire will no longer have to report its dispositions of bank of america stock within days of the transactions berkshires remaining stake is worth roughly bn
"
64,33,1728584248.0,Not cutloss until the end! ,not cutloss until the end 
39,1,1728592504.0,7.2k Gainz on Coinbase Put booiiiii Fomo says I sold early but need to get back to focusing on big boy job now…until next time,k gainz on coinbase put booiiiii fomo says i sold early but need to get back to focusing on big boy job nowuntil next time
17,19,1728607897.0,NEVER BACK DOWN NEVER WHAT!? You guys arent prepared to witness the greatest comeback of history,never back down never what you guys arent prepared to witness the greatest comeback of history
8,3,1728622200.0,Pltr gains  ,pltr gains  
3,6,1728645679.0,Today's Economic Calendar - Oct 11. ,todays economic calendar  oct  
53,7,1728578827.0,A true yolo +70% in a few hours. ,a true yolo  in a few hours 
1213,81,1728518131.0,Apple sells privacy to consumers. But it’s quietly helping police use iPhones for surveillance. ,apple sells privacy to consumers but its quietly helping police use iphones for surveillance 
2132,345,1728507529.0,"Bought 20 0DTE $575 SPY calls this morning, this gain is from only $880 invested. This got me thinking about the potential strategy of just buying 0DTE SPY calls every morning. If just today's movement of about 0.5% got a 400% return, aren't you statistically likely to make money, since whether SPY goes up or down is basically 50/50? Why wouldn't this work? Obviously you'd only bet like 10% of your account each day so you can make it back if you're wrong. ",bought  dte  spy calls this morning this gain is from only  invested this got me thinking about the potential strategy of just buying dte spy calls every morning if just todays movement of about  got a  return arent you statistically likely to make money since whether spy goes up or down is basically  why wouldnt this work obviously youd only bet like  of your account each day so you can make it back if youre wrong 
1,1,1728656225.0,Solid week I would say  Started sticking to my rules and waiting for breakouts and continuation now I’m see big Green Day’s lets keep it going 🕺,solid week i would say  started sticking to my rules and waiting for breakouts and continuation now im see big green days lets keep it going 
2,3,1728655664.0,"GOOGLE - The Actual Pioneer and Leader In AI This is a follow up  post to my analysis of TESLA VS WAYMO. 


Right now OpenAI is the clear leader when it comes to developing AI. Everyone else is playing catch up, however there's one company that doesn't get enough credit - GOOGLE. 


Google is the one that actually did most of the groundbreaking work in AI. They're the pioneers of technology in the field of AI. 


You must be thinking Why didn't we hear about this if they're the pioneers of AI? 


The reason is that Google failed to be the first one to commercialise it. 

Google had something called ""PROJECT MOONSHOTS.""  It was basically a division of Google solely focused on Ultra Ambitious Projects. 

AI research and development was a part of it.

In 2014 Google acquired DeepMind Labs that was founded in the UK in 2010.

DeepMind introduced neural Turing machines (neural networks that can access external memory like a conventional Turing machine), which is basically a computer that loosely resembles short-term memory in the human brain.


The Founding Research and Development Team of OpenAI, actually came from Google (DeepMind).


Now going back to ""PROJECT MOONSHOTS"" - in 2010 Larry Page and Sergy Brin turned  ""Project Moonshots"" into ""X COMPANY"".

Yes, it's called X, and they did it before Musk LMAO. 

This is what X Company does -

X's mission is to invent and launch ""moonshot"" technologies that aim to make the world a radically better place.

 A moonshot is defined by X as the intersection of a big problem, a radical solution, and breakthrough technology. 

Work at X is overseen by entrepreneur scientist Astro Teller, as CEO and ""Captain of Moonshots"".

The lab started with the development of Google's self-driving car.


SELF DRIVING VEHICLES are a brainchild of X Company. 

They are also working on some secret projects (presumably alongside the US government).


While Google fell behind OpenAI in commercializing and marketing of AI, they are still a leader in everything related to AI, Machine Learning and Fully Autonomous Vehicles. 


- - - - - - -


TLDR;

GOOGLE IS EVERYTHING ELON MUSK IS CLAIMING TO BE. 



Sources:
_  _  _  _  _  _  _ 

https://x.company/projects/

_ _ _ _ _ _ _ _ _

https://deepmind.google","google  the actual pioneer and leader in ai this is a follow up  post to my analysis of tesla vs waymo 


right now openai is the clear leader when it comes to developing ai everyone else is playing catch up however theres one company that doesnt get enough credit  google 


google is the one that actually did most of the groundbreaking work in ai theyre the pioneers of technology in the field of ai 


you must be thinking why didnt we hear about this if theyre the pioneers of ai 


the reason is that google failed to be the first one to commercialise it 

google had something called project moonshots  it was basically a division of google solely focused on ultra ambitious projects 

ai research and development was a part of it

in  google acquired deepmind labs that was founded in the uk in 

deepmind introduced neural turing machines neural networks that can access external memory like a conventional turing machine which is basically a computer that loosely resembles shortterm memory in the human brain


the founding research and development team of openai actually came from google deepmind


now going back to project moonshots  in  larry page and sergy brin turned  project moonshots into x company

yes its called x and they did it before musk lmao 

this is what x company does 

xs mission is to invent and launch moonshot technologies that aim to make the world a radically better place

 a moonshot is defined by x as the intersection of a big problem a radical solution and breakthrough technology 

work at x is overseen by entrepreneur scientist astro teller as ceo and captain of moonshots

the lab started with the development of googles selfdriving car


self driving vehicles are a brainchild of x company 

they are also working on some secret projects presumably alongside the us government


while google fell behind openai in commercializing and marketing of ai they are still a leader in everything related to ai machine learning and fully autonomous vehicles 


      


tldr

google is everything elon musk is claiming to be 



sources
             



        

"
16,8,1728599970.0,Lost 17k Someone lost more than me today?,lost k someone lost more than me today
48,10,1728577221.0,Holy Karp C,holy karp c
28,10,1728589361.0,"womp womp (started early july) 
made 10-12k and lost around 46k total for a net loss of 34k. i made some good money off mgk, nvidia, and amazon calls before the july drop screwed me. i’ll probably keep trying like the regard i am lol","womp womp started early july 
made k and lost around k total for a net loss of k i made some good money off mgk nvidia and amazon calls before the july drop screwed me ill probably keep trying like the regard i am lol"
141,7807,1728554232.0,"Daily Discussion Thread for October 10, 2024 [View Post](https://sh.reddit.com/r/wallstreetbets/comments/1g0f8jq)",daily discussion thread for october   view post
1255,427,1728508296.0,"17 years ago today On September 18, 2007, the Fed made a 50bps rate cut, greater than expected, despite reasonably good economic data. Markets rallied for about 3 weeks, and SPX closed at an all-time high on October 9, 2007, which would not be matched again until March 2013 in recovery from the Great Financial Crisis.

On September 18, 2024, the Fed made a 50bps rate cut, greater than expected, despite reasonably good economic data. Markets rallied for about 3 weeks, and SPX closed at an all-time high today, October 9, 2024.

This is not financial advice nearly as much as it is anecdotal evidence that we live in the Matrix.

Other thoughts:

The Sahm rule stood at only 17bps as of the unemployment reading of September 2007, as opposed to 50bps in September 2024. Albeit, unemployment was generally higher right around 4.6-4.7% between late 2006-2007. Additionally, the part-time gig economy is MASSIVE today compared to 2007 (but BLS still counts that as not “unemployed”)

The VIX was hovering between 16-18 during the October 2007 market peak, compared to 20-22 today.

Year-over-year CPI change from December 2006 to December 2007 was 4.1%, so inflation was NOT dead when the Fed started their easing cycle. The bond market is implying a similar problem in today’s economy with increasing US treasury yields, although current YoY CPI readings are generally lower today than in 2007.

Unlike 2007, this is an election year, and I operate under the assumption that all current BLS statistics are not just cooked, but deep fried.

EDIT: Going to try to address some of the repeated comments I’m seeing here.

“PAST PERFORMANCE DOESN’T GUARANTEE FUTURE RESULTS”

Of course, the main point of this post was to highlight the similarities in timelines between today and 17 years ago. Our economic situation is MASSIVELY different, although I’d argue still weak.

“BUT THERE’S NO SUBPRIME CRISIS”

Right, probably not. However, we still have skyrocketing consumer credit defaults paired with an abysmally low personal savings rate. Additionally, we have something along the lines of $1 trillion CRE loans with balloon payments or adjustable rates kicking in within the next 6 months, on a bunch of loans that are underwater with their respective banks, and many of which have been collateralized into CLOs and sold both domestically and internationally. I still think there will be some blood in the water.

Additionally, the median house price to median income ratio is HIGHER today than it was at its 2007-2008 absolute peak, so I’d still argue that real estate has been over-speculated.

“THE GOVERNMENT WON’T LET THE MARKET CRASH DURING AN ELECTION YEAR”

Probably not! In fact, there’s a very real scenario where the Fed steps in with hyper-QE if things hit the fan. Congress is scheduled to meet in January 2025 to negotiate the current US debt ceiling, and the US frankly can’t afford a recession right now - they need those tax dollars. Hyperinflation to erode the real value of the US debt and prop up the markets is highly plausible IMO.

“DUMB BER”

Dumb bol.

“POSITIONS OR BAN”

I’m short term bullish on bonds. TLT just bounced off its 200 SMA twice and I wouldn’t be surprised to see investors eat up those nice high yields if earnings season goes sour. I have 6 figures on TLT calls expiring post-election, I’m gonna wait on SPX plays until the election is over.

**TLDR: The Fed cut rates on the exact same date (9/18) in 2007 as 2024, and SPX hit an all-time high on the exact same date (10/9) in 2007 as 2024, except it was a massive crash afterwards in 2007. Trippy.**"," years ago today on september   the fed made a bps rate cut greater than expected despite reasonably good economic data markets rallied for about  weeks and spx closed at an alltime high on october   which would not be matched again until march  in recovery from the great financial crisis

on september   the fed made a bps rate cut greater than expected despite reasonably good economic data markets rallied for about  weeks and spx closed at an alltime high today october  

this is not financial advice nearly as much as it is anecdotal evidence that we live in the matrix

other thoughts

the sahm rule stood at only bps as of the unemployment reading of september  as opposed to bps in september  albeit unemployment was generally higher right around  between late  additionally the parttime gig economy is massive today compared to  but bls still counts that as not unemployed

the vix was hovering between  during the october  market peak compared to  today

yearoveryear cpi change from december  to december  was  so inflation was not dead when the fed started their easing cycle the bond market is implying a similar problem in todays economy with increasing us treasury yields although current yoy cpi readings are generally lower today than in 

unlike  this is an election year and i operate under the assumption that all current bls statistics are not just cooked but deep fried

edit going to try to address some of the repeated comments im seeing here

past performance doesnt guarantee future results

of course the main point of this post was to highlight the similarities in timelines between today and  years ago our economic situation is massively different although id argue still weak

but theres no subprime crisis

right probably not however we still have skyrocketing consumer credit defaults paired with an abysmally low personal savings rate additionally we have something along the lines of  trillion cre loans with balloon payments or adjustable rates kicking in within the next  months on a bunch of loans that are underwater with their respective banks and many of which have been collateralized into clos and sold both domestically and internationally i still think there will be some blood in the water

additionally the median house price to median income ratio is higher today than it was at its  absolute peak so id still argue that real estate has been overspeculated

the government wont let the market crash during an election year

probably not in fact theres a very real scenario where the fed steps in with hyperqe if things hit the fan congress is scheduled to meet in january  to negotiate the current us debt ceiling and the us frankly cant afford a recession right now  they need those tax dollars hyperinflation to erode the real value of the us debt and prop up the markets is highly plausible imo

dumb ber

dumb bol

positions or ban

im short term bullish on bonds tlt just bounced off its  sma twice and i wouldnt be surprised to see investors eat up those nice high yields if earnings season goes sour i have  figures on tlt calls expiring postelection im gonna wait on spx plays until the election is over

tldr the fed cut rates on the exact same date  in  as  and spx hit an alltime high on the exact same date  in  as  except it was a massive crash afterwards in  trippy"
7,5,1728608211.0,"9k on NETFLIX OPTIONS EASILY CAN NETFLIX ACTIVE A 600BILLION DOLLAR MARKET CAP 

Just weight it again”my 600LB Life” of the show keeps going we print

Not only watch hours all time high 


YOLO ALOS HAVE 100 sheas I bought at $390 I’m holding!","k on netflix options easily can netflix active a billion dollar market cap 

just weight it againmy lb life of the show keeps going we print

not only watch hours all time high 


yolo alos have  sheas i bought at  im holding"
88,10,1728558003.0,TD reaches $70M class-action settlement on broker commissions ,td reaches m classaction settlement on broker commissions 
7539,164,1728471943.0,I am naive ,i am naive 
183,81,1728538888.0,"Investing and Trading has Evolved. Tell Historians to Suck It Let's keep this brief potato heads. Go watch some NHL video from 1980. Now watch some NHL video from today. Those idiots in 1980 would absolutely suck today. They'd be too slow and too dumb to play anywhere near the top league today. Same with other sports. 

That's human nature. Through time we improve incrementally. We use the knowledge of prior generations as a base and add to it. So it's no surprise that an NBA player from 1980 would look like Krusty the Clown on a modern NBA team.

Well guess what, same shit has happened in investing & trading. And on an even bigger scale. The stakes are much higher. Instead of your high school star athlete making the big leagues, we're talking about the most powerful companies in the world making superyacht money. The amount of resources devoted to ""solving"" markets is astronomical.

So now we have a different landscape from your dad's stupid tech company in 1998. Yeah, they were cute firing up their shitty computers and randomly pressing some buttons in a suit & tie. Investors were onto something back in the 90's tech bubble though. They realized the trick to investing...

FRONT RUN EVERYTHING

Yeah bitch. Front run fucking everything. Radio on the internet? Fuck it, here's a billion dollars. Pets.com? Sure, you get $500M. Yeah, they took it a little too far in the 90's. But guess what, they were right. The internet was the future and the right early bets on internet companies made you wildly rich.

The reality was that, you could be wrong on 20 picks so long as you had the 1 Amazon / Microsoft / Apple. Plus, since people weren't front running as much back then, you didn't need to drop 100X Price-Sales on most of these picks (pre-1999). So who the fuck cares if you bought [Pets.com](http://Pets.com), [Broadcast.com](http://Broadcast.com), your dad's shitty tech startup? So long as you just accidentally bought one of the fucking juggernauts, all mistakes were easily forgiven.

So yeah, today we are thinking ""DAMN, Everything is so Expensive!"" ""AI is a Bubble!"" But guess what, that's just Boomer talk. From now on, everything that has a remote chance at being successful is gonna be front run to shit. You can forget about getting in at the bottom floor. Once an industry even hints that it will make a splash, some bastards are going to buy the shit out of it. The days where your dumb ass is gonna find Tesla at $10 or NVDA at $50 are long gone buddy.

So thanks for coming to my Ted Talk. Stop crying about valuations. The market is just smarter than it used to be. No one's saying THE PRICE IS RIGHT. They just don't give a fuck. Because a single 100X excuses 99 dingleberries.","investing and trading has evolved tell historians to suck it lets keep this brief potato heads go watch some nhl video from  now watch some nhl video from today those idiots in  would absolutely suck today theyd be too slow and too dumb to play anywhere near the top league today same with other sports 

thats human nature through time we improve incrementally we use the knowledge of prior generations as a base and add to it so its no surprise that an nba player from  would look like krusty the clown on a modern nba team

well guess what same shit has happened in investing  trading and on an even bigger scale the stakes are much higher instead of your high school star athlete making the big leagues were talking about the most powerful companies in the world making superyacht money the amount of resources devoted to solving markets is astronomical

so now we have a different landscape from your dads stupid tech company in  yeah they were cute firing up their shitty computers and randomly pressing some buttons in a suit  tie investors were onto something back in the s tech bubble though they realized the trick to investing

front run everything

yeah bitch front run fucking everything radio on the internet fuck it heres a billion dollars petscom sure you get m yeah they took it a little too far in the s but guess what they were right the internet was the future and the right early bets on internet companies made you wildly rich

the reality was that you could be wrong on  picks so long as you had the  amazon  microsoft  apple plus since people werent front running as much back then you didnt need to drop x pricesales on most of these picks pre so who the fuck cares if you bought petscom broadcastcom your dads shitty tech startup so long as you just accidentally bought one of the fucking juggernauts all mistakes were easily forgiven

so yeah today we are thinking damn everything is so expensive ai is a bubble but guess what thats just boomer talk from now on everything that has a remote chance at being successful is gonna be front run to shit you can forget about getting in at the bottom floor once an industry even hints that it will make a splash some bastards are going to buy the shit out of it the days where your dumb ass is gonna find tesla at  or nvda at  are long gone buddy

so thanks for coming to my ted talk stop crying about valuations the market is just smarter than it used to be no ones saying the price is right they just dont give a fuck because a single x excuses  dingleberries"
4245,247,1728477103.0,"Do either all or none! I guess Judge Amit Mehta has GOOG puts.

https://www.bloomberg.com/news/articles/2024-10-09/us-says-it-s-weighing-google-breakup-as-remedy-in-monopoly-case?leadSource=reddit_wall","do either all or none i guess judge amit mehta has goog puts

"
10,32,1728592402.0,NVIDIA IS TRASH TIER ,nvidia is trash tier 
44,15,1728561128.0,"There will be blood 🩸  CPI results don’t matter

Options activity for 10/11 look bearish

RSI rising

Two straight days of trading green green. 

Either the market will be bloody today or my account will lol.

Wish I had bought 10/11 expiration but depending on what happens today I’m turning 🐻 shortly.","there will be blood   cpi results dont matter

options activity for  look bearish

rsi rising

two straight days of trading green green 

either the market will be bloody today or my account will lol

wish i had bought  expiration but depending on what happens today im turning  shortly"
14,8,1728581837.0,"Private Equity Taking Peloton Private? (PTON) Listen up regards,

[https://13f.info/manager/0001576350/cusip/70614W100](https://13f.info/manager/0001576350/cusip/70614W100)

GTCR, actual investors and not regards like yourselves, is probably taking Peloton private. It owns 14 million shares as of June 30 (, with a likely cost of $3.22 per share, representing 3.775% of the company’s shares outstanding (CSO). While GTCR has a history of fully buying out closely-held companies, that is unlikely to be the case here. If its purpose is to influence the board, a significant ownership stake is generally around 5% to 10% or more, which can provide leverage in discussions with the company. GTCR would need to acquire at least another 5-6 million shares to surpass the 5% threshold, which would require the firm to file a Schedule 13D, indicating control intent. My speculation is that GTCR will continue to buy shares throughout this quarter and beyond to gain leverage with the board, especially as the company searches for a permanent CEO. The timing seems well-suited for both Peloton’s corporate restructuring and GTCR’s long-term strategy to influence control of the company. We will know more next quarter from its 13F disclosure. 

Get on the rocket ships ","private equity taking peloton private pton listen up regards



gtcr actual investors and not regards like yourselves is probably taking peloton private it owns  million shares as of june   with a likely cost of  per share representing  of the companys shares outstanding cso while gtcr has a history of fully buying out closelyheld companies that is unlikely to be the case here if its purpose is to influence the board a significant ownership stake is generally around  to  or more which can provide leverage in discussions with the company gtcr would need to acquire at least another  million shares to surpass the  threshold which would require the firm to file a schedule d indicating control intent my speculation is that gtcr will continue to buy shares throughout this quarter and beyond to gain leverage with the board especially as the company searches for a permanent ceo the timing seems wellsuited for both pelotons corporate restructuring and gtcrs longterm strategy to influence control of the company we will know more next quarter from its f disclosure 

get on the rocket ships "
